[
  {
    "group": "frauen",
    "subgroup": "bags",
    "urlPath": "Umhaengetasche-Love-Moschino",
    "sort": 1,
    "name": "Umh√§ngetasche von LOVE MOSCHINO",
    "image": "./img/Frauen/Taschen/Moschino-Tasche-Gelb.jpg",
    "priceFull": 179.9,
    "price25": 44.9,
    "mainVariation": 1268830803,
    "variationName": "Farbe",
    "variations": [
      {
        "name": "Gelb",
        "article": 1268830803,
        "image": "./img/Frauen/Taschen/Moschino-Tasche-Gelb.jpg",
        "color": "rgb(255,247,0)"
      },
      {
        "name": "Cognac",
        "article": 1268830804,
        "image": "./img/Frauen/Taschen/Moschin-Tasche-Cognac.jpg",
        "color": "#ab5c00"
      }
    ]
  },
  {
    "group": "frauen",
    "subgroup": "bags",
    "urlPath": "shopper-mollerus",
    "sort": 8,
    "name": "Shopper von MOLLERUS",
    "image": "./img/Frauen/Taschen/Shopper-Mollerus-rot.jpg",
    "priceFull": 499,
    "price25": 125,
    "mainVariation": 1185230102,
    "variationName": "Farbe",
    "variations": [
      {
        "name": "schwarz",
        "article": 1185230101,
        "image": "./img/Frauen/Taschen/Shopper-Mollerus-schwarz.jpg",
        "color": "#000000"
      },
      {
        "name": "dunkelrot",
        "article": 1185230102,
        "image": "./img/Frauen/Taschen/Shopper-Mollerus-rot.jpg",
        "color": "#990101"
      },
      {
        "name": "taupe",
        "article": 1185230104,
        "image": "./img/Frauen/Taschen/Shopper-Mollerus-taupe.jpg",
        "color": "#a18e7e"
      }
    ]
  },
  {
    "group": "haushalt",
    "subgroup": "bags",
    "urlPath": "shopper-mollerus",
    "sort": 8,
    "name": "Shopper von MOLLERUS",
    "image": "./img/Frauen/Taschen/Shopper-Mollerus-rot.jpg",
    "priceFull": 499,
    "price25": 125,
    "mainVariation": 1185230102,
    "variationName": "Farbe",
    "variations": [
      {
        "name": "schwarz",
        "article": 1185230101,
        "image": "./img/Frauen/Taschen/Shopper-Mollerus-schwarz.jpg",
        "color": "#000000"
      },
      {
        "name": "dunkelrot",
        "article": 1185230102,
        "image": "./img/Frauen/Taschen/Shopper-Mollerus-rot.jpg",
        "color": "#990101"
      },
      {
        "name": "taupe",
        "article": 1185230104,
        "image": "./img/Frauen/Taschen/Shopper-Mollerus-taupe.jpg",
        "color": "#a18e7e"
      }
    ]
  },
  {
    "group": "herren",
    "subgroup": "bags",
    "urlPath": "shopper-mollerus",
    "sort": 8,
    "name": "Shopper von MOLLERUS",
    "image": "./img/Frauen/Taschen/Shopper-Mollerus-rot.jpg",
    "priceFull": 499,
    "price25": 125,
    "mainVariation": 1185230102,
    "variationName": "Farbe",
    "variations": [
      {
        "name": "schwarz",
        "article": 1185230101,
        "image": "./img/Frauen/Taschen/Shopper-Mollerus-schwarz.jpg",
        "color": "#000000"
      },
      {
        "name": "dunkelrot",
        "article": 1185230102,
        "image": "./img/Frauen/Taschen/Shopper-Mollerus-rot.jpg",
        "color": "#990101"
      },
      {
        "name": "taupe",
        "article": 1185230104,
        "image": "./img/Frauen/Taschen/Shopper-Mollerus-taupe.jpg",
        "color": "#a18e7e"
      }
    ]
  }
]
